text,label
"Thật sự Bản phối này nghe phê cực, quá đỉnh! Xứng đáng 5 sao!",1
"Wow, Reaction đầu tiên nghe xong đã thích ngay! ✨",1
"Buồn khi Màn trình diễn nhạt, không để lại ấn tượng! Đừng mua nha! 👎",0
"Wow, Trải nghiệm đáng nhớ, recommend!",1
"Ôi trời, Video thú vị, xem ngay không nghĩ! 👏",1
"Ôi trời ơi, Nghe một lần là nghiện luôn, quá cuốn! 👏",1
"Khách sạn bẩn, mùi hôi, không như ảnh! Không recommend! 😡",0
"Thất vọng khi Không đúng size, đổi trả rất khó khăn! Đừng mua nha! 👎",0
"Quảng cáo quá nhiều, mất thiện cảm!",0
Hát live rất tệ so với bản thu! 👎,0
"Trời ơi, Hàng bị lỗi, shop không chịu hoàn tiền! 😒",0
"Thật sự Bài này hay quá, nghe mãi không chán!",1
"Thật ra Chương trình học cập nhật, kiến thức mới! 😍",1
"Trời ơi, Phản hồi chậm, không hỗ trợ học viên! 👎",0
"Thất vọng khi Mua nhầm phải hàng nhái, cực kỳ thất vọng! Không recommend! 💔",0
"Ôi trời ơi, Ăn uống ngon, phong cảnh đẹp, giá tốt! Quá đỉnh luôn! 💯",1
"Ôi trời ơi, Phim hay lắm, cốt truyện cuốn hút!",1
"Ôi trời ơi, Phim ý nghĩa, truyền cảm hứng sống! Mọi người thử đi! 🥰",1
"Buồn khi Quán bẩn, vệ sinh kém, rất lo ngại! 🤦",0
"Trời ơi, Không xứng với kỳ vọng của fan! Không recommend! 😤",0
"Trời ơi, Hỗ trợ kỹ thuật kém, hay bị lỗi! 😤",0
"Thật sự Chất liệu rẻ tiền, mỏng, không bền!",0
"Thật sự Phục vụ chậm, thái độ không tốt! Đừng mua nha! 😒",0
"Thật sự Hướng dẫn viên kém, biết ít hơn khách! Không recommend! 💔",0
Thật ra Cười không ngừng từ đầu đến cuối! Xứng đáng 5 sao! 👏,1
"Phải nói thật là Hàng thật 100%, không lo hàng nhái! 🔥",1
"Buồn khi Tốc độ chậm, lag liên tục, bực lắm! 💔",0
"Trời ơi, Giá chặt chém khách du lịch, tức lắm! Đừng mua nha! 💔",0
"Thật sự Tính năng đầy đủ, không bị lỗi! Quá đỉnh luôn!",1
"Thật ra Chương trình học cập nhật, kiến thức mới! ❤️",1
"Thật ra Sân vận động đẹp, tổ chức chuyên nghiệp! 😍",1
"Buồn khi Phim dở nhất năm, không recommend! Tránh xa ra! 😤",0
"Thật sự Tiền vé không xứng, phí thời gian! Không recommend! 💔",0
"Thật ra Mua lần đầu đã ưng, chắc chắn mua tiếp! Mọi người thử đi! 💯",1
"Tức lắm, Đặt món mãi không ra, phục vụ tệ! Không recommend! 😒",0
"Ôi trời ơi, Giao hàng nhanh, đóng gói cẩn thận! Quá đỉnh luôn! ❤️",1
"Trời ơi, Video chất lượng thấp, nghe không rõ! 😤",0
"Wow, Spa dịch vụ tốt, thư giãn cực kỳ! 😍",1
"Thật sự Đặt tối giao sáng hôm sau, siêu nhanh! Recommend nha! ❤️",1
"Buồn lắm, Phản hồi chậm, không hỗ trợ học viên! 😤",0
"Trời ơi, Sân vận động xuống cấp, cũ kỹ! 😤",0
"Buồn khi Mùi quán hôi, khó chịu, mất ngon! 😒",0
"Buồn khi Nhạc công nghiệp, thiếu cảm xúc thật! Không recommend! 👎",0
"Thật ra Bản phối này nghe phê cực, quá đỉnh! Mọi người thử đi! ✨",1
"Bài này không hay, không nghe lại nữa! Tránh xa ra! 😒",0
"Trời ơi, Cảnh quay tối, âm thanh kém! Hoàn tiền đi!",0
"Trời ơi, Ứng dụng hay bị crash, rất khó chịu! Không recommend! 👎",0
"Ôi trời, Thực phẩm chức năng hiệu quả, cảm thấy khỏe hơn! ❤️",1
Rất cảm ơn mọi sự ủng hộ của các bạn!,1
"Phải nói thật là Màn hình sắc nét, màu sắc trung thực! 🥰",1
"Thật ra Giai điệu hay, lời bài hát ý nghĩa! Quá đỉnh luôn! 😍",1
"Tức lắm, Hỗ trợ kỹ thuật kém, hay bị lỗi! 😤",0
"Thật ra Spa dịch vụ tốt, thư giãn cực kỳ! 💯",1
"Tài năng thật sự, không phải dạng vừa! Recommend nha! 🔥",1
"Hỗ trợ kỹ thuật kém, hay bị lỗi! 👎",0
"Phải nói thật là Tính năng đầy đủ, không bị lỗi! ✨",1
"Trời ơi, Không quay lại nữa, quá thất vọng! Không recommend! 💔",0
"Wow, Chương trình học cập nhật, kiến thức mới! 🔥",1
"Khuyến mãi tốt, freeship, rất đáng order! Recommend nha! 👏",1
"Thật ra Phòng rộng, view biển đẹp, rất thích! 🔥",1
"Thất vọng khi Hàng bị lỗi, shop không chịu hoàn tiền! Hoàn tiền đi! 😒",0
"Thật sự Quán yêu thích, tuần nào cũng ghé! 👏",1
"Trời ơi, Sân vận động xuống cấp, cũ kỹ! 💔",0
"Trời ơi, Đội nhà chơi dở, thất vọng lắm! 😡",0
"Trời ơi, Tin giả, sai sự thật, đừng tin! 💔",0
"Phải nói là Khóa học hay, giảng viên dạy dễ hiểu! ❤️",1
"Thật ra Bài này hay quá, nghe mãi không chán! Recommend nha! ❤️",1
"Học phí hợp lý, chất lượng cao! 👏",1
"Ôi trời, Platform học online dễ dùng, video rõ! ❤️",1
"Ôi trời, Chiến thuật hay, huấn luyện viên giỏi! 👏",1
"Thật sự Thua không xứng, chơi không hết sức! 😤",0
"Trời ơi, Học xong không biết làm gì, vô ích! 💔",0
"Phải nói thật là Cực kỳ hài lòng, 5 sao không đủ để chấm! Recommend nha! 🥰",1
"Trời ơi, Nhạc công nghiệp, thiếu cảm xúc thật! Hoàn tiền đi! 👎",0
"Kịch bản vô lý, đầy lỗ hổng logic! Đừng mua nha!",0
"Wow, Cảm ơn đã chia sẻ kiến thức quý! ❤️",1
"Ôi trời, Giảm cân hiệu quả, đúng như cam kết! 😍",1
"Shop uy tín, hàng chuẩn, sẽ mua lại! Quá đỉnh luôn! 😍",1
"Tức lắm, Camera xấu, ảnh mờ, không như quảng cáo! Hoàn tiền đi! 😒",0
"Phải nói là Chiến thuật hay, huấn luyện viên giỏi! 💯",1
"Tức lắm, Mưa suốt, không như dự báo, thất vọng! Hoàn tiền đi! 😡",0
Không xứng với kỳ vọng của fan! Tránh xa ra! 👎,0
"Concert lộn xộn, âm thanh kém, phí tiền! Đừng mua nha!",0
"Phải nói thật là Khẩu phần ăn nhiều, đáng đồng tiền! Quá đỉnh luôn! ✨",1
"Ôi trời, Tài liệu đầy đủ, bài tập thực tế! 💯",1
"Ôi trời ơi, Nhân viên phục vụ nhiệt tình, thân thiện! Xứng đáng 5 sao! 💯",1
"Wow, Reaction đầu tiên nghe xong đã thích ngay! Quá đỉnh luôn!",1
"Trời ơi, Video chất lượng thấp, nghe không rõ! 👎",0
"Ôi trời ơi, Chất liệu tốt, bền, đúng như mô tả! Quá đỉnh luôn! ✨",1
"Giảng viên dạy nhàm, không nhiệt tình!",0
"Tức lắm, Màu sắc khác hình, kích thước sai! Đừng mua nha! 👎",0
"Trời ơi, Học xong không biết làm gì, vô ích! 👎",0
"Thật sự Giá tốt nhất phân khúc, đáng mua! Xứng đáng 5 sao! 🔥",1
"Phải nói thật là Tính năng đầy đủ, không bị lỗi! 🔥",1
Thật sự Khóa học đắt mà không có gì mới! 💔,0
"Trời ơi, Không gian chật, ồn ào, không thoải mái! 🤦",0
"Phải nói là Tài liệu đầy đủ, bài tập thực tế! 😍",1
"Thật ra Xem xong vẫn còn muốn xem lại, quá hay! Mọi người thử đi! ✨",1
"Thật ra Không gian đẹp, view thoáng, rất thích! Recommend nha! ❤️",1
"Tức lắm, Beat đơn điệu, không có gì nổi bật! Đừng mua nha! 💔",0
"Thất vọng khi Camera xấu, ảnh mờ, không như quảng cáo! Đừng mua nha!",0
"Buồn khi Màn trình diễn nhạt, không để lại ấn tượng! Không recommend! 💔",0
"Phải nói thật là Màu đẹp y hình, kích thước vừa vặn! Quá đỉnh luôn! 🥰",1
"Thật sự Shop uy tín, hàng chuẩn, sẽ mua lại! ❤️",1
"Concert tổ chức chuyên nghiệp, rất ấn tượng! 😍",1
"Wow, Đặt tối giao sáng hôm sau, siêu nhanh! Mọi người thử đi! ✨",1
"Ôi trời, Học xong có việc làm ngay, xứng đáng!",1
"Tức lắm, Phục vụ chậm, thái độ không tốt! Tránh xa ra!",0
"Trời ơi, Màn hình dễ vỡ, thiết kế không bền! 😒",0
"Phải nói thật là Giá tốt nhất phân khúc, đáng mua!",1
"Wow, Kỹ xảo đỉnh, như phim Hollywood! ❤️",1
Thật sự Update xong lại sinh thêm lỗi mới! 🤦,0
"Thật ra Giảm cân hiệu quả, đúng như cam kết! 👏",1
"Thật ra Giọng hát quá hay, cảm xúc lắm! Quá đỉnh luôn!",1
"Tức lắm, Bình luận toxic, không lành mạnh! 💔",0
"Đã ăn nhiều lần, lần nào cũng ngon! Mọi người thử đi! 👏",1
"Ôi trời ơi, Diễn xuất tuyệt vời, rất ấn tượng! Mọi người thử đi! ✨",1
"Buồn lắm, Phòng khám bẩn, chờ đợi cả tiếng!",0
"Ôi trời ơi, Âm nhạc hay, beat căng, vocal xuất sắc! Xứng đáng 5 sao! 🥰",1
"Thật ra MV đẹp, ý nghĩa, xứng đáng được khen! Quá đỉnh luôn! ❤️",1
"Thật ra Spa dịch vụ tốt, thư giãn cực kỳ! 👏",1
"Phải nói là Thuốc hiệu quả, khỏi bệnh sau 3 ngày! 😍",1
"Phải nói thật là Tính năng đầy đủ, không bị lỗi! Xứng đáng 5 sao! 🔥",1
"Thất vọng khi Bài này không hay, không nghe lại nữa! Tránh xa ra!",0
"Phải nói thật là Màn trình diễn đỉnh, nổi da gà luôn! Xứng đáng 5 sao! 👏",1
"Trời ơi, Thông tin lỗi thời, không cập nhật! 👎",0
"Ứng dụng dễ dùng, giao diện đẹp, mượt! Quá đỉnh luôn! 🔥",1
"Thật sự Bác sĩ khám qua loa, thiếu trách nhiệm! 😤",0
"Tiền vé không xứng, phí thời gian! Không recommend! 👎",0
"Buồn lắm, Hỗ trợ kỹ thuật kém, hay bị lỗi! 💔",0
"Ôi trời ơi, Hàng đẹp lắm, recommend cho mọi người! Quá đỉnh luôn!",1
"Thật sự Màu đẹp y hình, kích thước vừa vặn! Recommend nha! 😍",1
Phải nói là Cảm ơn đã chia sẻ kiến thức quý! 🔥,1
"Buồn khi Mua về chưa dùng đã hỏng, chất lượng quá tệ! Tránh xa ra! 🤦",0
"Mua nhầm phải hàng nhái, cực kỳ thất vọng! Tránh xa ra! 😒",0
"Phải nói thật là Hiệu năng mạnh, chơi game mượt! Quá đỉnh luôn! ❤️",1
"Thật sự Quán yêu thích, tuần nào cũng ghé! Recommend nha! ❤️",1
"Wow, Thông tin chính xác, đáng tin cậy!",1
"Thất vọng khi Mua về 1 tháng đã hỏng, hàng lỗi! Hoàn tiền đi! 🤦",0
"Pin tụt nhanh, máy nóng, không chịu được! Hoàn tiền đi! 💔",0
"Thật sự Shop không phản hồi, dịch vụ tệ! Không recommend! 💔",0
"Pin tụt nhanh, máy nóng, không chịu được! 😒",0
"Wow, Cầu thủ xuất sắc, kỹ thuật điêu luyện! 💯",1
"Wow, Nhân viên phục vụ nhiệt tình, thân thiện! Mọi người thử đi!",1
"Ôi trời, Chiến thuật hay, huấn luyện viên giỏi! 💯",1
"Ôi trời, Thực phẩm chức năng hiệu quả, cảm thấy khỏe hơn! 😍",1
"Diễn xuất tuyệt vời, rất ấn tượng! Xứng đáng 5 sao! 🔥",1
"Tức lắm, Giảm cân thất bại, tiền mất mà không hiệu quả! 😤",0
"Thật ra Dịch vụ bảo hành tốt, hỗ trợ nhanh! 💯",1
"Wow, Ăn uống ngon, phong cảnh đẹp, giá tốt! 🔥",1
"Phim ý nghĩa, truyền cảm hứng sống! Quá đỉnh luôn! 😍",1
"Điểm du lịch bị thương mại hóa, nhàm! Đừng mua nha! 😤",0
"Thật ra Update liên tục, fix lỗi nhanh, tốt! Recommend nha! 💯",1
Thật sự Hát live rất tệ so với bản thu! Hoàn tiền đi! 👎,0
"Buồn khi Phí ship cao mà giao chậm, rất tức! Tránh xa ra! 😡",0
"Thật sự Mưa suốt, không như dự báo, thất vọng! 😡",0
"Học phí hợp lý, chất lượng cao! 🔥",1
"Thật ra Ẩm thực đặc trưng, đậm vị truyền thống! Mọi người thử đi! 👏",1
"Đặt món mãi không ra, phục vụ tệ! Hoàn tiền đi! 😤",0
"Dùng được 1 năm vẫn ổn, rất bền! Xứng đáng 5 sao! 🔥",1
"Trời ơi, Phục vụ chậm, thái độ không tốt! 😡",0
"Giáo viên nhiệt tình, giải đáp thắc mắc nhanh! 😍",1
"Tức lắm, Trận đấu nhàm, không có gì hay! 💔",0
"Nhân viên phục vụ nhiệt tình, thân thiện! Mọi người thử đi! ❤️",1
"Dùng được 1 năm vẫn ổn, rất bền! 👏",1
"Thật sự Update liên tục, fix lỗi nhanh, tốt! Mọi người thử đi! 💯",1
"Thật sự Màn hình sắc nét, màu sắc trung thực! Quá đỉnh luôn! 🥰",1
"Ôi trời, Đội tuyển chơi hay quá, tự hào lắm!",1
"Phải nói thật là Nghe một lần là nghiện luôn, quá cuốn! Mọi người thử đi! 🔥",1
"Trời ơi, Bình luận toxic, không lành mạnh!",0
"Ôi trời ơi, Đây là bản nhạc hay nhất năm nay! Quá đỉnh luôn! 🥰",1
"Wow, Hàng chính hãng, có tem xác nhận đầy đủ! Recommend nha! 😍",1
"Phải nói thật là Tour tổ chức chuyên nghiệp, hướng dẫn viên vui! Recommend nha! 🔥",1
"Thật ra Cầu thủ xuất sắc, kỹ thuật điêu luyện!",1
"Phải nói là Bài viết hay, chia sẻ rất hữu ích!",1
"Trời ơi, Giảng viên dạy nhàm, không nhiệt tình!",0
"Wow, Chuyến đi tuyệt vời, cảnh đẹp không tả! Recommend nha! 🥰",1
"Thật sự Kịch bản sáng tạo, kết cục bất ngờ! Xứng đáng 5 sao! 💯",1
"Trận thắng xứng đáng, thi đấu hết mình! 😍",1
"Phải nói là Thuốc hiệu quả, khỏi bệnh sau 3 ngày! 👏",1
"Tức lắm, Spa làm đau, nhân viên thiếu kinh nghiệm! 😤",0
"Ôi trời ơi, Thiết kế đẹp, mỏng nhẹ, cầm sang! Quá đỉnh luôn! 👏",1
"Ôi trời ơi, Đóng gói kỹ lưỡng, hàng không bị hỏng! Recommend nha! 👏",1
"Thật sự Creator này câu view, nội dung rỗng! 😡",0
"Wow, Nhân viên tư vấn nhiệt tình, hỗ trợ tốt! Mọi người thử đi! 🥰",1
"Ôi trời ơi, Đồ ăn tươi, chế biến cẩn thận, ngon lắm! Recommend nha! 🥰",1
Thật sự Update xong lại sinh thêm lỗi mới! 😒,0
"Tức lắm, Sân vận động xuống cấp, cũ kỹ! 😤",0
"Wow, Trận thắng xứng đáng, thi đấu hết mình! ❤️",1
"Thất vọng khi Mùi hóa chất nồng nặc, không dùng được! Đừng mua nha! 😒",0
"Thật ra Sản phẩm y như hình, chất lượng tốt! Recommend nha! 🔥",1
"Wow, Đặt tối giao sáng hôm sau, siêu nhanh! Recommend nha! ❤️",1
"Trời ơi, Đội nhà chơi dở, thất vọng lắm! 💔",0
"Trời ơi, Bảo hành kém, gặp lỗi mà không xử lý! Không recommend! 😒",0
"Trời ơi, Quán bẩn, vệ sinh kém, rất lo ngại! Hoàn tiền đi! 😤",0
"Thật ra Sản phẩm chăm sóc da tốt, da mịn hơn rõ rệt! 😍",1
"Ôi trời ơi, Chất liệu tốt, bền, đúng như mô tả! Quá đỉnh luôn! 💯",1
"Phim hay lắm, cốt truyện cuốn hút! 🥰",1
"Wow, Series này hay, mong ra tập tiếp sớm! ❤️",1
Thất vọng hoàn toàn với sản phẩm này! Đừng mua nha! 😤,0
Reaction đầu tiên nghe xong đã thích ngay! Quá đỉnh luôn! 😍,1
"Buồn khi Diễn xuất như gỗ, không cảm xúc! Không recommend! 💔",0
"Trời ơi, Dịch vụ tệ, nhân viên thái độ xấu! Hoàn tiền đi! 💔",0
"Phải nói thật là Phòng rộng, view biển đẹp, rất thích! Mọi người thử đi! 😍",1
"Tức lắm, Tin giả, sai sự thật, đừng tin! 👎",0
"Ôi trời, Cầu thủ xuất sắc, kỹ thuật điêu luyện! 😍",1
"Thật sự Diễn xuất tuyệt vời, rất ấn tượng! Mọi người thử đi! ❤️",1
"Phải nói thật là Kỹ xảo đỉnh, như phim Hollywood! Xứng đáng 5 sao! ❤️",1
"Ôi trời, Nội dung chất lượng, đáng follow!",1
"Thất vọng khi Tốc độ chậm, lag liên tục, bực lắm! Không recommend! 🤦",0
"Tài năng thật sự, không phải dạng vừa! Quá đỉnh luôn!",1
"Phải nói thật là Pin trâu, máy nhanh, camera đẹp! Xứng đáng 5 sao! ✨",1
Hát live rất tệ so với bản thu! 💔,0
"Sân vận động xuống cấp, cũ kỹ! 👎",0
"Phải nói là Platform học online dễ dùng, video rõ! ❤️",1
"Tức lắm, Mùi hóa chất nồng nặc, không dùng được! Không recommend! 👎",0
"Trời ơi, Bom tấn nhưng nội dung trống rỗng! 🤦",0
"Ôi trời ơi, Quán ngon, giá hợp lý, không gian sạch! Xứng đáng 5 sao! 😍",1
"Wow, Diễn viên phù hợp vai, diễn tự nhiên! Xứng đáng 5 sao!",1
Thất vọng khi Ảnh quá đẹp nhưng thực tế rất xấu! Đừng mua nha!,0
"Thật ra Khuyến mãi tốt, freeship, rất đáng order! Xứng đáng 5 sao! 🔥",1
"Wow, Tài liệu đầy đủ, bài tập thực tế! 💯",1
"Thật ra Giá tốt nhất phân khúc, đáng mua! Recommend nha! 🔥",1
"Không đúng size, đổi trả rất khó khăn! Không recommend! 👎",0
"Buồn khi Phim dở nhất năm, không recommend! Hoàn tiền đi! 🤦",0
"Sản phẩm y như hình, chất lượng tốt! Recommend nha! 👏",1
Thật sự Giá cao nhưng chất lượng bình thường! Hoàn tiền đi! 😡,0
"Thật sự Hàng chính hãng, có tem xác nhận đầy đủ! Xứng đáng 5 sao! 💯",1
"Ôi trời, Học phí hợp lý, chất lượng cao! 🔥",1
"Giá đắt mà khẩu phần ít, không đáng! Hoàn tiền đi! 💔",0
"Buồn khi Mua về chưa dùng đã hỏng, chất lượng quá tệ! Hoàn tiền đi! 👎",0
"Diễn xuất tuyệt vời, rất ấn tượng! Recommend nha! 👏",1
"Thật sự Hiệu năng mạnh, chơi game mượt! Quá đỉnh luôn! ❤️",1
"Buồn khi Phim dở nhất năm, không recommend! Hoàn tiền đi! 👎",0
"Trời ơi, Tốc độ chậm, lag liên tục, bực lắm! Không recommend! 💔",0
"Wow, Thuốc hiệu quả, khỏi bệnh sau 3 ngày! 👏",1
"Thật sự Thiết kế đẹp, mỏng nhẹ, cầm sang! Mọi người thử đi! 😍",1
"Thất vọng khi Phòng nhỏ, thiếu tiện nghi, đắt vô lý! Hoàn tiền đi! 😡",0
"Thất vọng khi Tour lộn xộn, không như chương trình!",0
"Ôi trời ơi, Thiết kế đẹp, mỏng nhẹ, cầm sang! Xứng đáng 5 sao! 😍",1
"Ôi trời ơi, Bản phối này nghe phê cực, quá đỉnh! Xứng đáng 5 sao! ❤️",1
"Chiến thuật tệ, hàng thủ yếu! 😤",0
"Wow, Chất lượng như hàng ngoại nhưng giá Việt! Mọi người thử đi! 💯",1
"Thật ra Đã ăn nhiều lần, lần nào cũng ngon! Recommend nha! 👏",1
Giá cao nhưng chất lượng bình thường! Tránh xa ra! 💔,0
"Ôi trời ơi, Sản phẩm y như hình, chất lượng tốt! Recommend nha! 🥰",1
"Nhóm này quá tài năng, tự hào lắm! Recommend nha! 👏",1
"Thất vọng khi Pin tụt nhanh, máy nóng, không chịu được! Hoàn tiền đi! 💔",0
"Video thú vị, xem ngay không nghĩ! 👏",1
"Phải nói thật là Mua lần đầu đã ưng, chắc chắn mua tiếp! Mọi người thử đi! 💯",1
"Thật sự Fan từ ngày đầu, giờ vẫn hết mình ủng hộ! Mọi người thử đi! 💯",1
"Tài liệu đầy đủ, bài tập thực tế!",1
"Ôi trời ơi, Thiết kế đẹp, mỏng nhẹ, cầm sang! Recommend nha! 💯",1
Thật sự Đây là bản nhạc hay nhất năm nay! Xứng đáng 5 sao! ❤️,1
"Wow, Chiến thuật hay, huấn luyện viên giỏi! ❤️",1
Tính năng quảng cáo nhiều nhưng thực tế ít! Tránh xa ra! 😡,0
"Phải nói thật là Tour tổ chức chuyên nghiệp, hướng dẫn viên vui! Quá đỉnh luôn! 😍",1
"Thật sự Chất liệu rẻ tiền, mỏng, không bền! Tránh xa ra! 😒",0
"Phải nói thật là Kịch bản sáng tạo, kết cục bất ngờ! Mọi người thử đi! 💯",1
"Buồn lắm, Video dài dòng, mất thời gian xem! 😡",0
"Tức lắm, Quảng cáo hay hơn phim thật, thất vọng! Đừng mua nha! 💔",0
"Tức lắm, Quảng cáo hay hơn phim thật, thất vọng! Không recommend! 👎",0
"Tức lắm, Sân vận động xuống cấp, cũ kỹ!",0
"Chuyến đi tuyệt vời, cảnh đẹp không tả! Quá đỉnh luôn! 🔥",1
Thật sự Đây là bản nhạc hay nhất năm nay! 👏,1
"Phải nói là Bài viết hay, chia sẻ rất hữu ích! 👏",1
"Sản phẩm chăm sóc da tốt, da mịn hơn rõ rệt! 🔥",1
"Tức lắm, Hát dở quá, không hay chút nào! Tránh xa ra! 👎",0
"Giọng hát quá hay, cảm xúc lắm! Recommend nha! ✨",1
"Thật sự Diễn viên phù hợp vai, diễn tự nhiên! Quá đỉnh luôn! 🥰",1
"Phải nói thật là Ứng dụng dễ dùng, giao diện đẹp, mượt! Xứng đáng 5 sao! 👏",1
"Phải nói thật là Hiệu năng mạnh, chơi game mượt! Mọi người thử đi! 🔥",1
"Ôi trời ơi, Resort xịn, dịch vụ 5 sao thật sự! Quá đỉnh luôn! ✨",1
"Thật sự Giá tốt nhất phân khúc, đáng mua! Mọi người thử đi!",1
"Ôi trời ơi, Đã dùng được 3 tháng vẫn tốt, chất lượng! Quá đỉnh luôn! 💯",1
"Thật sự Nhân viên phục vụ nhiệt tình, thân thiện! Recommend nha! ✨",1
"Tức lắm, Đội nhà chơi dở, thất vọng lắm!",0
"Phòng rộng, view biển đẹp, rất thích! Mọi người thử đi! 🔥",1
"Tức lắm, Kết cục tệ, không thỏa mãn chút nào! 😡",0
"Buồn lắm, Creator này câu view, nội dung rỗng! 👎",0
"Trời ơi, Chuyến đi thảm họa, tiền mất tật mang! Hoàn tiền đi! 👎",0
"Thật sự Đặt món mãi không ra, phục vụ tệ! Hoàn tiền đi!",0
"Thật ra Update liên tục, fix lỗi nhanh, tốt! Recommend nha! ❤️",1
Cảm ơn đã chia sẻ kiến thức quý! 🔥,1
"Thật ra Fan từ ngày đầu, giờ vẫn hết mình ủng hộ! Mọi người thử đi! ✨",1
"Thật ra Trận thắng xứng đáng, thi đấu hết mình! 👏",1
"Trời ơi, Ngộ độc thực phẩm sau khi ăn, kinh khủng! Không recommend! 😤",0
"Thật sự Shop không phản hồi, dịch vụ tệ! Không recommend! 👎",0
"Trời ơi, Kem dưỡng da gây kích ứng, nổi mụn! 💔",0
"Thật sự Bình luận toxic, không lành mạnh! 👎",0
"Đây mới là âm nhạc đích thực, quá hay! Quá đỉnh luôn! 🥰",1
"Thật sự Tour lộn xộn, không như chương trình! Đừng mua nha! 💔",0
"Thật ra Nội dung chất lượng, đáng follow! 🔥",1
"Trời ơi, Tiền vé không xứng, phí thời gian! Tránh xa ra! 🤦",0
"Phải nói là Video thú vị, xem ngay không nghĩ! 👏",1
Phải nói thật là Nhìn biểu diễn mà phấn khích cả người! Mọi người thử đi! 🥰,1
"Tức lắm, Phim kéo dài quá, nhàm chán! Đừng mua nha! 😒",0
"Wow, Vải mềm mịn, không gây kích ứng da! 😍",1
"Phải nói thật là Mua lần đầu đã ưng, chắc chắn mua tiếp! Mọi người thử đi! 👏",1
"Trời ơi, Mưa suốt, không như dự báo, thất vọng! Không recommend! 😤",0
"MV đẹp, ý nghĩa, xứng đáng được khen! 💯",1
Thật sự Thất vọng hoàn toàn với sản phẩm này! 😡,0
"Trời ơi, Bác sĩ khám qua loa, thiếu trách nhiệm!",0
"Trời ơi, Hàng kém chất lượng, không như quảng cáo! Không recommend!",0
"Thất vọng khi Không đúng size, đổi trả rất khó khăn! Tránh xa ra! 😡",0
"Tức lắm, Bom tấn nhưng nội dung trống rỗng! Đừng mua nha! 😡",0
Thất vọng khi Tính năng quảng cáo nhiều nhưng thực tế ít! Đừng mua nha! 😡,0
"Thật sự Giao hàng nhanh, đóng gói cẩn thận! Mọi người thử đi! 🥰",1
"Wow, Giá hợp lý, chất lượng vượt kỳ vọng! Mọi người thử đi! 😍",1
"Ôi trời ơi, Update liên tục, fix lỗi nhanh, tốt! Recommend nha! 😍",1
Thật sự Giá cao nhưng không xứng đáng! Hoàn tiền đi! 👎,0
"Đặt món mãi không ra, phục vụ tệ! Tránh xa ra! 😤",0
"Lời bài hát vô nghĩa, không đầu tư! Tránh xa ra! 💔",0
"Thật sự Đồ ăn không ngon, nhạt nhẽo, dở! Không recommend! 😤",0
"Cảm ơn bạn rất nhiều, bài viết hữu ích!",1
"Tức lắm, Phòng khám bẩn, chờ đợi cả tiếng! 😡",0
"Wow, Giọng hát quá hay, cảm xúc lắm! Recommend nha! ✨",1
"Tài liệu lỗi thời, không cập nhật!",0
"Thất vọng khi Đồ ăn nguội lạnh, không được hâm lại!",0
"Thật ra Bài viết hay, chia sẻ rất hữu ích! 😍",1
"Phải nói thật là Quán ngon, giá hợp lý, không gian sạch! Xứng đáng 5 sao! 🥰",1
"Đóng gói cẩu thả, hàng bị móp méo! Hoàn tiền đi!",0
"Trời ơi, Đóng gói cẩu thả, hàng bị móp méo!",0
"Buồn khi Phim kéo dài quá, nhàm chán! Tránh xa ra!",0
"Phải nói là Hài hước quá, cười không nhặt được miệng! 😍",1
"Màn trình diễn đỉnh, nổi da gà luôn! Mọi người thử đi! ❤️",1
"Wow, Đội tuyển chơi hay quá, tự hào lắm! ❤️",1
"Thật sự Thông tin lỗi thời, không cập nhật!",0
"Phải nói là Series này hay, mong ra tập tiếp sớm! 😍",1
"Concert tổ chức chuyên nghiệp, rất ấn tượng! 💯",1
"Thật ra Fan từ ngày đầu, giờ vẫn hết mình ủng hộ! ❤️",1
"Bài viết hay, chia sẻ rất hữu ích! 💯",1
"Tức lắm, Không như cam kết, tiền mất tật mang! 💔",0
