text,label
Thật ra Reaction đầu tiên nghe xong đã thích ngay! ❤️,1
"Trận đấu kịch tính, xem mê không rời! ❤️",1
"Hàng kém chất lượng, không như quảng cáo! Hoàn tiền đi! 🤦",0
"Ôi trời ơi, Nhân viên tư vấn nhiệt tình, hỗ trợ tốt! Mọi người thử đi! 😍",1
"Thật sự Ngộ độc thực phẩm sau khi ăn, kinh khủng! Tránh xa ra! 😒",0
"Buồn lắm, Thuốc không hiệu quả, uống mãi không khỏi! 😡",0
"Tức lắm, Bảo hành kém, gặp lỗi mà không xử lý! Tránh xa ra! 😤",0
"Thật sự Phòng rộng, view biển đẹp, rất thích! Mọi người thử đi! ❤️",1
"Trời ơi, Giảng viên dạy nhàm, không nhiệt tình! 💔",0
"Kem dưỡng da gây kích ứng, nổi mụn! 👎",0
"Thật sự Chất liệu tốt, bền, đúng như mô tả! Mọi người thử đi! 🥰",1
"Tức lắm, Video dài dòng, mất thời gian xem! 💔",0
"Hài hước quá, cười không nhặt được miệng! 🔥",1
"Trời ơi, Không hiểu sao bài này lại được khen! Không recommend! 😡",0
"Tức lắm, Kịch bản vô lý, đầy lỗ hổng logic! Đừng mua nha! 🤦",0
"Thật ra Giọng hát quá hay, cảm xúc lắm! Mọi người thử đi! 👏",1
"Ôi trời ơi, Đóng gói kỹ lưỡng, hàng không bị hỏng! Mọi người thử đi! 👏",1
"Tức lắm, Ảnh quá đẹp nhưng thực tế rất xấu! 💔",0
"Thất vọng khi Mua về 1 tháng đã hỏng, hàng lỗi! Tránh xa ra! 😡",0
"Bài này chữa lành tâm hồn, cảm ơn nghệ sĩ! Mọi người thử đi! 💯",1
"Trời ơi, Không quay lại nữa, quá thất vọng! 😤",0
"Phải nói thật là Phim Việt ngày càng chất lượng, tự hào! Quá đỉnh luôn! 👏",1
"Ôi trời ơi, Nhân viên tư vấn nhiệt tình, hỗ trợ tốt! Recommend nha! 👏",1
"Ôi trời ơi, Vải mềm mịn, không gây kích ứng da! Quá đỉnh luôn! 😍",1
"Thật sự Khách sạn bẩn, mùi hôi, không như ảnh! Đừng mua nha! 👎",0
"Phải nói là Thực phẩm chức năng hiệu quả, cảm thấy khỏe hơn! 👏",1
"Buồn khi Màn trình diễn nhạt, không để lại ấn tượng! Đừng mua nha! 🤦",0
"Khuyến mãi tốt, freeship, rất đáng order! Quá đỉnh luôn! 🔥",1
"Thất vọng khi Shop không phản hồi, dịch vụ tệ! Đừng mua nha! 🤦",0
"Trời ơi, Phim chán, cốt truyện nhàm, dở lắm!",0
"Buồn lắm, Nội dung nhạy cảm, không phù hợp! 👎",0
"Phải nói thật là Hàng thật 100%, không lo hàng nhái!",1
"Tức lắm, Bình luận toxic, không lành mạnh! 👎",0
"Tức lắm, Điểm du lịch bị thương mại hóa, nhàm! 😒",0
"Ôi trời ơi, Cười không ngừng từ đầu đến cuối! Quá đỉnh luôn!",1
"Phải nói thật là Cực kỳ hài lòng, 5 sao không đủ để chấm! Mọi người thử đi! 😍",1
"Hàng bị lỗi, shop không chịu hoàn tiền! Hoàn tiền đi! 😡",0
"Buồn lắm, Creator này câu view, nội dung rỗng! 😤",0
"Tức lắm, Kết cục tệ, không thỏa mãn chút nào! Không recommend! 😒",0
"Thật sự Ngộ độc thực phẩm sau khi ăn, kinh khủng! 🤦",0
"Thất vọng khi Giá đắt mà khẩu phần ít, không đáng! Tránh xa ra!",0
"Thật ra Chiến thuật hay, huấn luyện viên giỏi! ❤️",1
"Thật ra Shop phản hồi nhanh, giải quyết vấn đề tốt! Recommend nha!",1
"Wow, Chất liệu tốt, bền, đúng như mô tả! Mọi người thử đi! 🔥",1
"Bảo hành kém, gặp lỗi mà không xử lý! Tránh xa ra! 😤",0
"Phải nói thật là Tài năng thật sự, không phải dạng vừa! Mọi người thử đi! 😍",1
"Không như cam kết, tiền mất tật mang! 😤",0
"Ôi trời ơi, Dùng được 1 năm vẫn ổn, rất bền! Quá đỉnh luôn!",1
"Ôi trời, Tài liệu đầy đủ, bài tập thực tế! 🔥",1
"Thật ra Nghe một lần là nghiện luôn, quá cuốn! Xứng đáng 5 sao! 🔥",1
"Thật sự Giá hợp lý, chất lượng vượt kỳ vọng! Xứng đáng 5 sao! 😍",1
"Phải nói thật là Chuyến đi tuyệt vời, cảnh đẹp không tả! Xứng đáng 5 sao! 🥰",1
"Trời ơi, Hát dở quá, không hay chút nào! Đừng mua nha! 😤",0
"Ôi trời, Thông tin chính xác, đáng tin cậy!",1
"Trời ơi, Camera xấu, ảnh mờ, không như quảng cáo! 👎",0
"Tức lắm, MV kém, ý tưởng nhàm, đầu tư thấp! Tránh xa ra! 💔",0
"Wow, Cầu thủ xuất sắc, kỹ thuật điêu luyện!",1
"Ôi trời ơi, Cảnh quay đẹp, âm nhạc hay, xem mê! Quá đỉnh luôn! ✨",1
Bom tấn nhưng nội dung trống rỗng! 👎,0
"Wow, Địa điểm lý tưởng cho gia đình! 🥰",1
"Ôi trời ơi, Nhìn biểu diễn mà phấn khích cả người! Xứng đáng 5 sao! 🥰",1
"Phải nói thật là Ăn uống ngon, phong cảnh đẹp, giá tốt! 🥰",1
"Tức lắm, Giá chặt chém khách du lịch, tức lắm! Tránh xa ra! 😤",0
"Trời ơi, Nội dung nhàm, không có giá trị! 😡",0
Thất vọng khi Hát live rất tệ so với bản thu! Tránh xa ra! 🤦,0
"Wow, Ăn uống ngon, phong cảnh đẹp, giá tốt! Mọi người thử đi! ✨",1
"Đây mới là âm nhạc đích thực, quá hay! Quá đỉnh luôn! ❤️",1
"Nhân viên tư vấn nhiệt tình, hỗ trợ tốt! Xứng đáng 5 sao! 👏",1
"Thật sự Giai điệu hay, lời bài hát ý nghĩa! Mọi người thử đi! 🔥",1
"Ôi trời ơi, Giao hàng nhanh, đóng gói cẩn thận! Mọi người thử đi! 😍",1
"Trời ơi, Thuốc không hiệu quả, uống mãi không khỏi! 😤",0
"Thật sự Video dài dòng, mất thời gian xem! 💔",0
"Thật sự Đồ ăn không ngon, nhạt nhẽo, dở! Tránh xa ra! 😒",0
"Ôi trời ơi, Màu đẹp y hình, kích thước vừa vặn! 😍",1
"Nội dung nhàm, không có giá trị!",0
"Giảm cân thất bại, tiền mất mà không hiệu quả! 👎",0
"Tức lắm, Thua không xứng, chơi không hết sức!",0
"Buồn khi Kịch bản vô lý, đầy lỗ hổng logic! Đừng mua nha! 👎",0
"Phải nói thật là Phim Việt ngày càng chất lượng, tự hào! Mọi người thử đi!",1
"Thật ra Trải nghiệm đáng nhớ, recommend! Xứng đáng 5 sao! ❤️",1
"Đồ ăn tươi, chế biến cẩn thận, ngon lắm! Recommend nha! 💯",1
"Đóng gói kỹ lưỡng, hàng không bị hỏng! Mọi người thử đi! 💯",1
"Thực phẩm chức năng giả, không tác dụng! 👎",0
"Tức lắm, Thua không xứng, chơi không hết sức! 😤",0
"Buồn lắm, Giảng viên dạy nhàm, không nhiệt tình! 😤",0
"Ôi trời ơi, Kịch bản sáng tạo, kết cục bất ngờ! Mọi người thử đi! ❤️",1
"Phải nói thật là Quán yêu thích, tuần nào cũng ghé! Xứng đáng 5 sao! ✨",1
"Thật ra Đã ăn nhiều lần, lần nào cũng ngon! Quá đỉnh luôn! 💯",1
"Trời ơi, Thất vọng hoàn toàn với sản phẩm này! Đừng mua nha! 😒",0
"Phải nói là Chương trình học cập nhật, kiến thức mới! 😍",1
"Trời ơi, Đội nhà chơi dở, thất vọng lắm! 😤",0
Thật sự Địa điểm lý tưởng cho gia đình! Quá đỉnh luôn! 👏,1
"Thật sự Âm nhạc hay, beat căng, vocal xuất sắc! Xứng đáng 5 sao! 🔥",1
"Thuốc hiệu quả, khỏi bệnh sau 3 ngày! 🔥",1
"Thất vọng khi Diễn xuất như gỗ, không cảm xúc! 😡",0
"Thật ra Kịch bản sáng tạo, kết cục bất ngờ! Mọi người thử đi! ❤️",1
"Buồn khi Giao hàng chậm quá, đợi cả tuần! 😤",0
"Thật sự Không như cam kết, tiền mất tật mang! 💔",0
"Thật sự Khẩu phần ăn nhiều, đáng đồng tiền! Xứng đáng 5 sao! 😍",1
"Trời ơi, Thua không xứng, chơi không hết sức! 👎",0
"Thất vọng khi Mua nhầm phải hàng nhái, cực kỳ thất vọng! Hoàn tiền đi! 😤",0
"Buồn khi Tiền vé không xứng, phí thời gian! Không recommend! 😤",0
"Thất vọng khi Cảnh quay tối, âm thanh kém! Tránh xa ra! 😒",0
"Video chất lượng thấp, nghe không rõ! 💔",0
"Wow, Nghe một lần là nghiện luôn, quá cuốn! Recommend nha! ❤️",1
"Phải nói thật là Màn trình diễn đỉnh, nổi da gà luôn! Xứng đáng 5 sao! 🔥",1
"Phải nói thật là Shop phản hồi nhanh, giải quyết vấn đề tốt! Recommend nha! ❤️",1
"Phải nói thật là Giai điệu hay, lời bài hát ý nghĩa! Quá đỉnh luôn! ✨",1
"Tức lắm, Camera xấu, ảnh mờ, không như quảng cáo! Hoàn tiền đi!",0
Chất lượng như hàng ngoại nhưng giá Việt! Mọi người thử đi! 🥰,1
"Thất vọng khi Chuyến đi thảm họa, tiền mất tật mang! 👎",0
"Ôi trời ơi, Shop uy tín, hàng chuẩn, sẽ mua lại! Recommend nha! 🔥",1
"Ôi trời, Bác sĩ tận tâm, chẩn đoán chính xác! 👏",1
"Trời ơi, Kịch bản vô lý, đầy lỗ hổng logic! Hoàn tiền đi! 😡",0
"Ôi trời ơi, Ẩm thực đặc trưng, đậm vị truyền thống! Xứng đáng 5 sao!",1
"Thật sự Đội nhà chơi dở, thất vọng lắm!",0
"Thất vọng khi Bài này không hay, không nghe lại nữa! Tránh xa ra! 😒",0
"Học phí hợp lý, chất lượng cao!",1
"Tức lắm, Hàng giả, không mua nữa, lừa đảo! Đừng mua nha! 👎",0
"Wow, Đây mới là âm nhạc đích thực, quá hay! Quá đỉnh luôn! 🔥",1
Chất lượng như hàng ngoại nhưng giá Việt! Quá đỉnh luôn! 💯,1
"Phim Việt ngày càng chất lượng, tự hào! Xứng đáng 5 sao! 💯",1
Cộng đồng học viên hỗ trợ nhau tốt!,1
"Thật ra Phòng khám sạch sẽ, không phải chờ lâu!",1
"Giọng hát quá hay, cảm xúc lắm! 😍",1
"Thật ra Đội tuyển chơi hay quá, tự hào lắm! ❤️",1
"Đặt phòng dễ, check-in nhanh, tuyệt! Quá đỉnh luôn! 🔥",1
"Thực phẩm chức năng hiệu quả, cảm thấy khỏe hơn! 🔥",1
"Thật sự Bài này chữa lành tâm hồn, cảm ơn nghệ sĩ! ❤️",1
"Ôi trời ơi, Ẩm thực đặc trưng, đậm vị truyền thống! Xứng đáng 5 sao! 🔥",1
"Thật ra Cầu thủ xuất sắc, kỹ thuật điêu luyện! ❤️",1
"Wow, Nghệ sĩ có tâm, sản phẩm chất lượng! Mọi người thử đi! 💯",1
"Thật sự Màn trình diễn nhạt, không để lại ấn tượng! Không recommend! 😡",0
"Thật sự Nhân viên phục vụ nhiệt tình, thân thiện! Recommend nha! ❤️",1
"Beat đơn điệu, không có gì nổi bật! Tránh xa ra! 😒",0
"Phải nói là Platform học online dễ dùng, video rõ! 💯",1
Thất vọng khi Giá cao nhưng không xứng đáng! Hoàn tiền đi! 😒,0
"Wow, Diễn viên phù hợp vai, diễn tự nhiên! 💯",1
"Thật sự Giao hàng chậm quá, đợi cả tuần! Hoàn tiền đi! 👎",0
"Trời ơi, Không hiểu sao bài này lại được khen! Đừng mua nha! 😡",0
"Thật sự Bài này hay quá, nghe mãi không chán! Quá đỉnh luôn! ❤️",1
"Trời ơi, Trọng tài thiên vị, bất công!",0
"Wow, Hát live mà hay hơn cả studio, tài thật! Mọi người thử đi! ❤️",1
"Tức lắm, Đường đi khó, thiếu biển báo, bực bội! Tránh xa ra!",0
"Thật sự Tour tổ chức chuyên nghiệp, hướng dẫn viên vui! 👏",1
"Trời ơi, Giá cao nhưng không xứng đáng!",0
"Tức lắm, Thực phẩm chức năng giả, không tác dụng! 😡",0
"Phải nói là Hài hước quá, cười không nhặt được miệng! 💯",1
"Ôi trời ơi, Mua lần đầu đã ưng, chắc chắn mua tiếp! Recommend nha!",1
"Hỗ trợ kỹ thuật kém, hay bị lỗi! 😤",0
"Trời ơi, Thông tin lỗi thời, không cập nhật! 😤",0
"Thật sự Phim chán, cốt truyện nhàm, dở lắm! Tránh xa ra! 👎",0
"Buồn khi Nhạc công nghiệp, thiếu cảm xúc thật! 🤦",0
"Thật sự Tài liệu lỗi thời, không cập nhật! 💔",0
"Thất vọng khi Mua về 1 tháng đã hỏng, hàng lỗi! Không recommend! 🤦",0
"Wow, Bài này hay quá, nghe mãi không chán! Mọi người thử đi!",1
"Đội nhà chơi dở, thất vọng lắm!",0
"Bài này chữa lành tâm hồn, cảm ơn nghệ sĩ! Recommend nha! 😍",1
"Thật sự Trận đấu nhàm, không có gì hay! 💔",0
"Thật ra Đây mới là âm nhạc đích thực, quá hay!",1
"Thông tin lỗi thời, không cập nhật! 😤",0
"Buồn lắm, Bác sĩ khám qua loa, thiếu trách nhiệm! 👎",0
"Ôi trời, Khóa học hay, giảng viên dạy dễ hiểu! ❤️",1
"Phải nói thật là Quán ngon, giá hợp lý, không gian sạch! Xứng đáng 5 sao! ✨",1
"Phải nói thật là Pin trâu, máy nhanh, camera đẹp! Quá đỉnh luôn! ✨",1
"Trời ơi, Hướng dẫn viên kém, biết ít hơn khách!",0
"Buồn khi Hát dở quá, không hay chút nào! Hoàn tiền đi! 💔",0
"Tài năng thật sự, không phải dạng vừa! Mọi người thử đi! ❤️",1
"Quán bẩn, vệ sinh kém, rất lo ngại! 👎",0
"Dịch vụ tệ, nhân viên thái độ xấu! Tránh xa ra! 😤",0
"Wow, Sạch sẽ, vệ sinh, an tâm khi ăn! Xứng đáng 5 sao! 👏",1
"Thật ra Pin trâu, máy nhanh, camera đẹp! Quá đỉnh luôn! ❤️",1
"Tức lắm, Hàng bị lỗi, shop không chịu hoàn tiền! 😡",0
"Ôi trời ơi, Cực kỳ hài lòng, 5 sao không đủ để chấm! Quá đỉnh luôn! ✨",1
"Thật ra Hát live mà hay hơn cả studio, tài thật! Recommend nha! ❤️",1
"Wow, Giá hợp lý, chất lượng vượt kỳ vọng! 🔥",1
"Ôi trời ơi, Khách sạn đẹp, sạch, nhân viên tốt bụng! Xứng đáng 5 sao!",1
"Khách sạn đẹp, sạch, nhân viên tốt bụng! Recommend nha! ❤️",1
"Phải nói là Series này hay, mong ra tập tiếp sớm!",1
"Wow, Xem xong vẫn còn suy nghĩ mãi, hay thật! Quá đỉnh luôn! 💯",1
"Tức lắm, Không hiểu sao bài này lại được khen! 👎",0
"Tức lắm, Màu sắc khác hình, kích thước sai! Hoàn tiền đi!",0
"Thất vọng khi Màu sắc khác hình, kích thước sai! Tránh xa ra! 😒",0
"Phải nói thật là Hiệu năng mạnh, chơi game mượt! 🔥",1
"Wow, Nhóm này quá tài năng, tự hào lắm! Recommend nha! ❤️",1
"Trời ơi, Concert lộn xộn, âm thanh kém, phí tiền! Đừng mua nha! 💔",0
"Buồn khi Trình diễn thiếu chuyên nghiệp, nhiều lỗi! Không recommend! 💔",0
"Phải nói là Sân vận động đẹp, tổ chức chuyên nghiệp! 😍",1
"Phải nói thật là Phim ý nghĩa, truyền cảm hứng sống! Recommend nha! 💯",1
"Thất vọng khi Mùi hóa chất nồng nặc, không dùng được! 😤",0
"Thất vọng khi Hàng kém chất lượng, không như quảng cáo! Đừng mua nha! 😡",0
"Buồn khi Bảo hành kém, gặp lỗi mà không xử lý! 😒",0
"Trời ơi, Gym thiết bị cũ nát, không an toàn! 😡",0
"Thật sự Diễn xuất tuyệt vời, rất ấn tượng! 🥰",1
"Phải nói là Spa dịch vụ tốt, thư giãn cực kỳ!",1
"Tức lắm, Bác sĩ khám qua loa, thiếu trách nhiệm! 😤",0
"Thật sự Creator này câu view, nội dung rỗng! 👎",0
"Phim chán, cốt truyện nhàm, dở lắm! 😤",0
"Thật ra Chuyến đi tuyệt vời, cảnh đẹp không tả! Xứng đáng 5 sao! 💯",1
"Ôi trời, Chương trình học cập nhật, kiến thức mới! 💯",1
"Thật sự Ngộ độc thực phẩm sau khi ăn, kinh khủng! Hoàn tiền đi!",0
"Phải nói thật là Giá hợp lý, chất lượng vượt kỳ vọng! Xứng đáng 5 sao! 💯",1
"Phải nói là Gym tốt, huấn luyện viên nhiệt tình!",1
Giá cao nhưng chất lượng bình thường! Không recommend! 😡,0
"Trời ơi, Không gian chật, ồn ào, không thoải mái! Hoàn tiền đi! 🤦",0
"Thật sự Quảng cáo hay hơn phim thật, thất vọng! 😡",0
"Vải mềm mịn, không gây kích ứng da! Recommend nha! ✨",1
"Ôi trời ơi, Thiết kế đẹp, tinh tế, rất đáng mua! ❤️",1
"Wow, Gym tốt, huấn luyện viên nhiệt tình!",1
"Thật sự Hàng giả, không mua nữa, lừa đảo! Tránh xa ra! 😒",0
"Thật sự Hỗ trợ kỹ thuật kém, hay bị lỗi! 👎",0
"Ôi trời ơi, Shop phản hồi nhanh, giải quyết vấn đề tốt! Xứng đáng 5 sao! ❤️",1
"Tức lắm, Không như cam kết, tiền mất tật mang!",0
"Thật sự Nội dung nhạy cảm, không phù hợp! 👎",0
"Phải nói thật là Thiết kế đẹp, tinh tế, rất đáng mua! Recommend nha! ✨",1
"Buồn khi Trình diễn thiếu chuyên nghiệp, nhiều lỗi! Đừng mua nha! 💔",0
"Thật ra Hài hước quá, cười không nhặt được miệng!",1
"Tức lắm, Thực phẩm chức năng giả, không tác dụng! 👎",0
"Thật sự Đồ ăn tươi, chế biến cẩn thận, ngon lắm! Recommend nha! ✨",1
"Ôi trời, Cảm ơn đã chia sẻ kiến thức quý! 👏",1
"Tức lắm, Chuyến đi thảm họa, tiền mất tật mang! Hoàn tiền đi! 💔",0
"Wow, Creator này có tâm, làm nội dung kỹ! 😍",1
"Thật ra Hàng đẹp lắm, recommend cho mọi người! Quá đỉnh luôn!",1
"Ôi trời ơi, Kỹ xảo đỉnh, như phim Hollywood! Quá đỉnh luôn! 🥰",1
"Ôi trời, Sản phẩm chăm sóc da tốt, da mịn hơn rõ rệt!",1
Ảnh quá đẹp nhưng thực tế rất xấu! Hoàn tiền đi! 😒,0
"Phải nói là Thông tin chính xác, đáng tin cậy! 💯",1
"Thật sự Trình diễn thiếu chuyên nghiệp, nhiều lỗi! Tránh xa ra! 😤",0
"Thất vọng khi Hướng dẫn viên kém, biết ít hơn khách! Hoàn tiền đi! 😡",0
"Quảng cáo hay hơn phim thật, thất vọng! Tránh xa ra! 🤦",0
Thật sự Địa điểm lý tưởng cho gia đình! Recommend nha! ✨,1
"Thật sự MV kém, ý tưởng nhàm, đầu tư thấp! Tránh xa ra! 👎",0
"Buồn khi Hướng dẫn viên kém, biết ít hơn khách! Đừng mua nha! 👎",0
"Phải nói thật là Âm nhạc hay, beat căng, vocal xuất sắc! Xứng đáng 5 sao! 😍",1
"Trời ơi, Phim chán, cốt truyện nhàm, dở lắm! Không recommend! 😒",0
"Tức lắm, Giá cao nhưng không xứng đáng! Tránh xa ra! 😒",0
"Wow, Điểm đến tuyệt đẹp, sẽ quay lại! ❤️",1
"Bác sĩ khám qua loa, thiếu trách nhiệm! 💔",0
"Wow, Hàng thật 100%, không lo hàng nhái! Xứng đáng 5 sao! 🔥",1
"Tức lắm, Đường đi khó, thiếu biển báo, bực bội! Tránh xa ra! 😒",0
"Ẩm thực đặc trưng, đậm vị truyền thống! Mọi người thử đi! 💯",1
"Phải nói thật là Đã dùng được 3 tháng vẫn tốt, chất lượng! Mọi người thử đi! 👏",1
"Thật ra Dùng được 1 năm vẫn ổn, rất bền! 👏",1
Thật sự Thất vọng hoàn toàn với sản phẩm này! Đừng mua nha! 👎,0
Thất vọng khi Ảnh quá đẹp nhưng thực tế rất xấu! 😤,0
"Wow, Trận thắng xứng đáng, thi đấu hết mình! 💯",1
"Phải nói thật là Trải nghiệm đáng nhớ, recommend! Recommend nha! 👏",1
"Ôi trời ơi, Hàng đẹp lắm, recommend cho mọi người! Mọi người thử đi!",1
"Thật ra Nội dung chất lượng, đáng follow! 👏",1
"Wow, Đội tuyển chơi hay quá, tự hào lắm! 💯",1
"Tức lắm, Phản hồi chậm, không hỗ trợ học viên! 👎",0
"Wow, Chất lượng như hàng ngoại nhưng giá Việt! 💯",1
"Thật ra Hàng chính hãng, có tem xác nhận đầy đủ! Quá đỉnh luôn! ❤️",1
"Thật ra Màn trình diễn đỉnh, nổi da gà luôn! Xứng đáng 5 sao! ❤️",1
"Thật sự Đóng gói kỹ lưỡng, hàng không bị hỏng! Mọi người thử đi! 🔥",1
"Ôi trời ơi, Dịch vụ bảo hành tốt, hỗ trợ nhanh! ✨",1
Buồn khi Giá cao nhưng chất lượng bình thường! Đừng mua nha!,0
"Trời ơi, Hàng kém chất lượng, không như quảng cáo! Đừng mua nha!",0
"Thật ra Đồ ăn tươi, chế biến cẩn thận, ngon lắm! Mọi người thử đi!",1
"Buồn lắm, Thua không xứng, chơi không hết sức!",0
"Trời ơi, Trọng tài thiên vị, bất công! 😤",0
"Buồn khi Beat đơn điệu, không có gì nổi bật! Không recommend! 😤",0
"Trời ơi, Spa làm đau, nhân viên thiếu kinh nghiệm! 😤",0
"Wow, Thuốc hiệu quả, khỏi bệnh sau 3 ngày! ❤️",1
"Buồn lắm, Gym thiết bị cũ nát, không an toàn! 😤",0
"Thật sự Ứng dụng hay bị crash, rất khó chịu! Không recommend! 💔",0
"Mùi hóa chất nồng nặc, không dùng được! Không recommend! 👎",0
"Giảm cân hiệu quả, đúng như cam kết! 😍",1
"Thất vọng khi Nhạc công nghiệp, thiếu cảm xúc thật! 🤦",0
"Thật sự Khách sạn bẩn, mùi hôi, không như ảnh! Tránh xa ra! 💔",0
"Buồn khi Shop không phản hồi, dịch vụ tệ! 😤",0
Thật ra Nhìn biểu diễn mà phấn khích cả người! Mọi người thử đi!,1
"Thật ra Xem xong vẫn còn muốn xem lại, quá hay! Quá đỉnh luôn! 💯",1
"Mua về 1 tháng đã hỏng, hàng lỗi! Tránh xa ra! 💔",0
"Phải nói thật là Khẩu phần ăn nhiều, đáng đồng tiền! Mọi người thử đi!",1
"Wow, Trận đấu kịch tính, xem mê không rời! ❤️",1
"Tức lắm, Giá chặt chém khách du lịch, tức lắm! Không recommend! 👎",0
"Thật ra Học phí hợp lý, chất lượng cao! 😍",1
"Tức lắm, Quảng cáo quá nhiều, mất thiện cảm! 😡",0
"Wow, Khẩu phần ăn nhiều, đáng đồng tiền! 😍",1
"Thật sự Đặt món mãi không ra, phục vụ tệ! Hoàn tiền đi! 😤",0
"Trời ơi, Phòng khám bẩn, chờ đợi cả tiếng!",0
"Thất vọng khi Pin tụt nhanh, máy nóng, không chịu được! Hoàn tiền đi! 😡",0
"Ôi trời ơi, Điểm đến tuyệt đẹp, sẽ quay lại! Quá đỉnh luôn! 🔥",1
"Wow, Đây là bản nhạc hay nhất năm nay! ✨",1
Thật sự Khóa học đắt mà không có gì mới!,0
"Phải nói là Hài hước quá, cười không nhặt được miệng!",1
"Phòng nhỏ, thiếu tiện nghi, đắt vô lý! 👎",0
"Phải nói là Phòng khám sạch sẽ, không phải chờ lâu! 💯",1
"Thật ra Màn hình sắc nét, màu sắc trung thực! Recommend nha! 🔥",1
"Trời ơi, Bác sĩ khám qua loa, thiếu trách nhiệm! 😤",0
"Thất vọng khi Đường đi khó, thiếu biển báo, bực bội! Hoàn tiền đi! 😡",0
Thật ra Cộng đồng học viên hỗ trợ nhau tốt! ❤️,1
"Ôi trời ơi, Không gian đẹp, view thoáng, rất thích! Quá đỉnh luôn! 🔥",1
"Thật ra Trải nghiệm đáng nhớ, recommend! Quá đỉnh luôn! 💯",1
"Tức lắm, Đóng gói cẩu thả, hàng bị móp méo! Đừng mua nha! 😡",0
"Phải nói thật là Giá hợp lý, chất lượng vượt kỳ vọng! Mọi người thử đi! ❤️",1
"Thật sự Sạch sẽ, vệ sinh, an tâm khi ăn! Xứng đáng 5 sao! 🥰",1
"Tức lắm, Khóa học đắt mà không có gì mới! 😤",0
"Trời ơi, Video chất lượng thấp, nghe không rõ! 💔",0
"Thật sự Màn hình dễ vỡ, thiết kế không bền! 👎",0
"Wow, Bác sĩ tận tâm, chẩn đoán chính xác! 😍",1
"Thật sự Món này ngon nhất tôi từng ăn, tuyệt! ✨",1
"Thất vọng khi Màn trình diễn nhạt, không để lại ấn tượng! Tránh xa ra! 💔",0
"Trời ơi, Tour lộn xộn, không như chương trình! Không recommend! 😒",0
"Buồn lắm, Giảm cân thất bại, tiền mất mà không hiệu quả! 💔",0
"Thật ra Hàng chính hãng, có tem xác nhận đầy đủ! Mọi người thử đi! ❤️",1
"Phải nói là Trận đấu kịch tính, xem mê không rời! 😍",1
"Wow, Bác sĩ tận tâm, chẩn đoán chính xác! 🔥",1
"Wow, Khách sạn đẹp, sạch, nhân viên tốt bụng! Recommend nha!",1
"Ôi trời, Creator này có tâm, làm nội dung kỹ!",1
"Thất vọng khi Diễn xuất như gỗ, không cảm xúc! Đừng mua nha! 😤",0
"Tức lắm, Màn hình dễ vỡ, thiết kế không bền! Đừng mua nha! 👎",0
"Phải nói thật là Khuyến mãi tốt, freeship, rất đáng order! Quá đỉnh luôn! 👏",1
"Giao hàng nhanh, đóng gói cẩn thận! 😍",1
"Ôi trời ơi, Sạch sẽ, vệ sinh, an tâm khi ăn! 😍",1
"Ôi trời ơi, Kịch bản sáng tạo, kết cục bất ngờ! Xứng đáng 5 sao! 🥰",1
"Thật sự Pin trâu, máy nhanh, camera đẹp! Quá đỉnh luôn! ❤️",1
"Thất vọng khi Mua về chưa dùng đã hỏng, chất lượng quá tệ! 😡",0
"Trời ơi, Phòng khám bẩn, chờ đợi cả tiếng! 😡",0
"Thật ra Vải mềm mịn, không gây kích ứng da! Xứng đáng 5 sao! 👏",1
"Thật sự Hát dở quá, không hay chút nào! Tránh xa ra! 😤",0
"Thất vọng khi Phí ship cao mà giao chậm, rất tức! Đừng mua nha! 😤",0
"Tức lắm, Giao hàng chậm quá, đợi cả tuần! Đừng mua nha! 💔",0
"Hàng kém chất lượng, không như quảng cáo! Đừng mua nha! 😡",0
"Thật sự Thông tin lỗi thời, không cập nhật! 💔",0
"Tức lắm, Video chất lượng thấp, nghe không rõ!",0
Cộng đồng học viên hỗ trợ nhau tốt! 😍,1
"Thật sự Tài liệu lỗi thời, không cập nhật! 👎",0
